patient_id,surname,name,patronymic,doctor_id,doctor_info,health_complaints,medical_history,treatment_plan,appointments_info,medications_info
1,Белкин,Дмитрий,Дмитриевич,111,Антибиотиков Андрей Андреевич,"Головная боль, кашель, температура",Ранее болел ОРВИ и простой простудой,,2025-01-15 10:00 (Подтверждена),Парацетамол: По 1 таблетке 3 раза в день после еды (Принято)
2,Волков,Андрей,Владимирович,111,Антибиотиков Андрей Андреевич,"Кашель, высокая температура",Ранее болел простой простудой,,2025-01-16 11:30 (Подтверждена),Амоксиклав: По 1 таблетке 2 раза в день 7 дней (Не принято)
3,Котов,Владислав,Владиславович,111,Антибиотиков Андрей Андреевич,"Озноб, головная боль, головокружение",Ранее болел ОРВИ,,,Ибупрофен: По 1 таблетке при температуре (Не принято)
4,Медведев,Михаил,Михайлович,222,Вируснов Виталий Витальевич,"Насморк, красное горло, кашель",Ранее болел ангиной,,2025-01-18 09:00 (Подтверждена),Тантум Верде: По 1 впрыскиванию 3 раза в день (Принято)
5,Стрелкин,Николай,Николаевич,222,Вируснов Виталий Витальевич,"Насморк, головная боль, головокружение",Ранее ничем не болел,,,Називин: По 1 впрыскиванию в каждую ноздрю 2 раза в день (Не принято)
6,Петров,Антон,Антонович,222,Вируснов Виталий Витальевич,"Кашель, озноб",Ранее болел простой простудой,,2025-01-20 16:45 (Подтверждена),Арбидол: По 2 капсулы 4 раза в день (Не принято)
7,Соколов,Олег,Олегович,222,Вируснов Виталий Витальевич,"Кашель, насморк, головная боль, красное горло",Ранее болел ОРВИ и простой простудой,,,Стрепсилс: По 1 таблетке каждые 2-3 часа (Не принято)
